"Mysore Paper Mills ltd, Badravati, Shimoga District.",Shimoga,Paper and pulp,YES,,1,,1,
"West Coast Paper Mills, Bangurnagar, Dandeli, Haliyal Taluk, U.K.District.",Uttara Kannada,Paper and pulp,YES,,1,,1,
"Grasilene division, Unit of Grasim Industries, Kumarapattanam, Ranebennur Taluk, Haveri District",Haveri,Paper and pulp,YES,,1,,1,
"Bank Note Paper Mill India Pvt Ltd., (A JV of SPMCIL- A Govt of India Enterprise & BRBNMPL-A Subsidiary of RBI), Naganahally village, Belavatha village, Note Mudran nagar, Metagalli, Mysuru",Mysore,Paper and pulp,YES,,1,,1,
"Badami Sugars Ltd.,Badami, Bagalkot district",Bagalkot,Sugar,,Not operating (2),2,,2,Closed
"Bannari Amman Sugars (Previously M/s. Mahadeshwara Sugars), Kunthur, Kollegal Taluk, Chamarajanagar District",Chamarajanagar,Sugar & Co-Gen,YES,,1,,1,
"Bhavani Khandasari sugars Ltd, Sy. No. 289, Baroor village, Bidar District",Bidar,Sugar,NO,Not operating (2),2,,2,
"Bidar SSK Ltd., Hallikhed SF – 585 415, Bidar.",Bidar,Sugar,NO,"Closure order issued by CPCB
22.08.16",0,"Cosent refused
22.02.16",0,"Closure order issued by CPCB
22.08.16"
"Dakshina Kannada SSK Ltd., Brahmavara – 576 213, Udupi Taluk, Udupi Dist.",Udupi,Sugar,,Not operating (2),2,,2,Permanently closed
"Laila Sugars Ltd., (Previously M/s.Bhagyalakshmi SSK Niyamit), Khanapura – 592 302, Belgaum District.",Belgaum,Sugar,YES,,1,,1,
"The Ghataprabha SSK Niyamit, Singlapur village, Gokak Taluk, Belgaum District.",Belgaum,Sugar,YES,,1,,1,
"Sri. Chamundeswari sugars (previously M/s.Hemavathi SSK Ltd.), Srinivasapura, Channarayapatna Taluk Hassan District.",Hassan,Sugar,,Not operating (2),2,,2,Taken Expansion
"India Sugars & Refineries Ltd., Chitwadgi, Bellary District",Ballary,Sugar,NO,Not operating (2),2,,2,Closed
"Shree Renuka Sugars (Previously M/s.Raibag SSK Niyamit), Bavachi village, Raibag Taluk, Belgaum District.",Belgaum,Sugar,YES,,1,,1,
"Gokak sugars Limited, Kolavi-591344, Gokak Taluk, Belgaum District",Belgaum,Sugar & Co-Gen,YES,,1,,1,
"Sri Malaprabha Sahakari Sakkare Karkhane Niyamit,  M.K.Hubli – 591 153, Belgaum District.",Belgaum,Sugar,YES,,1,,1,
"Shri Shivsagar Sugars & Agro Products Ltd. Udapudi (P), Ramdurga Tq, Belgaum Dist.",Belgaum,Sugar,YES,,1,,1,consent pending
"Gyanba Sugars Ltd.[Previously Bhadra SSK (<5 Cr.)],  Doddabathi, Davangere Taluk, Davangere District.",Davangere,Sugar,,Not operating (2),2,,2,Permanently closed
"Shree Ambika sugars Ltd., (Lesse of Srirama SSK) Chunchanakatte, K.R.Nagar Taluk, Mysore District",Mysore,Sugar,,Not operating (2),2,,2,Closed
"Vanivilas Co-op Sugar Industry, Hiriyur, Chitradurga District",Chitradurga,Sugar,,Not operating (2),2,,2,Permanently closed
"Gangavathi Sugar Industries, Gangavathi, Raichur District",Raichur,Sugar,,Not operating (2),2,,2,Permanently closed
"Shree Kedaranath Sugars & Agro Products Ltd.,Kerkalmatti, Badami Taluk, Bagalkote District (Sugar unit)",Bagalkot,Sugar,,Not operating (2),2,,2,Closed
"SPR Sugars, Pvt Ltd., Kanchugranahalli, Bidadi Hobli, Ramanagaram Taluk & District",Ramanagaram,Sugar,,Not operating (2),2,,2,Permanently closed
"Shri Balaji Sugars and Chemicals Private Limited, Yargal and Madari villages, Muddebihal Taluk, Vijayapura District",Vijayapura,Sugar & Co-Gen,YES,,1,,1,
"Bhalkeshwara Sugars Ltd.,Bajola village, Balki Tq, Bidar Dist.",Bidar,Sugar & Co-Gen,YES,,1,,1,
"Bilagi Sugars,Badagandi village, Bilagi Taluk Bagalkot District. ",Bagalkot,Sugar & Co-Gen,YES,,1,,1,
"Coromandal Sugars (Previously M/s.ICL Sugars), K.R.Pet, Mandya.",Mandya,Sugar & Co-Gen,YES,,1,,1,
"Shree Halasiddanatha SSK, Shankaranandanagar, Nippani, Belgaum District.",Belgaum,Sugar & Co-Gen,YES,,1,,1,"Closure order issued by CPCB
22.08.16 revoked on 05.07.17"
"Shiraguppi Sugar Works Limited,Kagwad village, Athani Taluk, Belgaum district",Belgaum,Sugar & Co-Gen,YES,,1,,1,
"Dnyanyogi Sri Shivakumara Swamiji Sugars Ltd., Sri Siddeshwara nagar, Hirebevanur, Indi tq, Bijapur Dist. ",Vijayapura,Sugar & Co-Gen,YES,,1,,1,
"G.M. Sugars (Previously M/s. Karnataka SSK Ltd)., Haveri District",Haveri,Sugar & Co-Gen,YES,,1,,1,
"Pandavapura SSK Ltd., (Kothari Sugars and Chemicals), Pandavapura, Mandya Dist.",Mandya,Sugar & Co-Gen,NO,Not issued consent as they have Not provided CEMS,0,,1,consent pending
"NSL Sugars (Lessee of M/s SSKN, Aland) Bhunsoor Post – 585 302, Aland Taluk, Gulbarga District.",Gulberga,Sugar & Co-Gen,YES,,1,,1,
"Davangere Sugar Company Ltd., Kukkavada, Davangere Taluk and  District.",Davangere,Sugar & Co-Gen,YES,,1,,1,
"Gem Sugars Ltd., Kundargi village, Biligi taluk, Bagalkot Dist. 587 204. ",Bagalkot,"Sugar, Co-gen and distillery",YES,,1,,1,
"Godavari Biorefineries, P.O. Sameerwadi, Tal. Mudhol, Dist. Bagalkot. ",Bagalkot,Sugar & Co-Gen,YES,,1,,1,
"Jamkhandi Sugars Ltd., Hirepadasalagi village, Nagnur Post, Jamkhandi Taluk, Bagalkot Dist.",Bagalkot,Sugar & Co-Gen,YES,,1,,1,
"The Mahatma Gandhi SSK Niyamith, Bhalki Tq., Hulgi Village, Bidar Dist.",Bidar,Sugar & Co-Gen,YES,,1,,1,
"Naranja SSK, g n Nagar, Imampur village, BidarTaluk &  Disrict.",Bidar,Sugar & Co-Gen,NO,Consent refused on 15.03.16,0,,1,
"Sri Prabhulingeshwara Sugars & Chemicals Ltd., Bagalkote dist.",Bagalkot,Sugar & Co-Gen,YES,,1,,1,
"Rytara Sahakari Sakkare Kharkhane, Ranna Nagar, Timmapur-587 122, Mudhol Tq, Bagalkot-Dist.",Bagalkot,Sugar & Co-Gen,YES,,1,,1,
"NSL Sugars (Tungabhadra) Ltd.(Formely M/s. Siruguppa sugar & Chemicals Ltd.,) Desanur – 583 140, Siruguppa Tq, Bellary District. ",Ballary,Sugar & Co-Gen,YES,,1,,1,
"The Krishna SSK Ltd.,Sankonatti village, Athani Taluk, Belgaum District.",Belgaum,Sugar & Co-Gen,YES,,1,,1,
"The Nandi SSK Niyamit Krishnanagar (Chickagalagali), Post: Hosur – 587 117, Bijapur Tq. & Dist. ",Vijayapura,Sugar & Co-Gen,YES,,1,,1,
"Venkateshwara Power Project Limited, Beddkihal, Chikkodi Taluk,  Belgaum District",Belgaum,Sugar & Co-Gen,YES,,1,,1,
"Nirani Sugars, Kulali Cross, JKD Road, Mudhol, Bagalkot Taluk and  District. ",Bagalkot,Sugar & Co-Gen,YES,,1,,1,
"Shree Someshwara SSK Limited, Siddasamudra village, Belawadi Post, Bailhongal Taluk, Belgaum District",Belgaum,Sugar & Co-Gen,YES,,1,,1,
"Indian Cane Power Ltd., Uttur village, Mudhol Taluk, Bagalkote District",Bagalkot,Sugar & Co-Gen,YES,,1,,1,
"EID Parry(India)  Limited (GMR Dhanalaxmi) Khanpeth village, Ramdurg  Taluk  Belgaum  District",Belgaum,Sugar & Co-Gen,YES,,1,,1,
"EID Parry( Iindia) Limited (Sadashiva Sugars), Nagaral village, Bagalkote Taluk & District",Bagalkot,Sugar & Co-Gen,YES,,1,,1,
"Ugar Sugar Works (unit-2) Malli post, Jevargi Taluk, Glubarga District.",Gulberga,Sugar & Co-Gen,YES,,1,,1,
"Shivshakthi Sugars Ltd, Mayoor Chitra Mandir Road, Ankali,Chikodi Taluk, Belgaum Dist.",Belgaum,Sugar & Co-Gen,YES,,1,,1,
"Manali Sugars Limited, Malgana village, Sindhagi Taluk, Bijapur District",Vijayapura,Sugar & Co-Gen,YES,,1,,1,
"Jamkhandi Sugars, unit-II, Nad, KD Post, Indi Taluk, Bijapur District",Vijayapura,Sugar & Co-Gen,YES,,1,,1,
"KPR Sugar Mills Private Limited, Almel village, Sindhagi Taluk, Bijapur District",Vijayapura,Sugar & Co-Gen,YES,,1,,1,
"Soubhagya Laxmi Sugars Ltd.,Hirenandi Village, Gokak Tq, Belgaum Dist.",Belgaum,Sugar & Co-Gen,NO,"NPD issued 
04.04.17",0,"NPD issued 
04.04.17",0,"Closure order issued by CPCB
29.03.17"
"Sri Basaveswara Sugars Private Limited, Karjol village Vijayapur Taluk & District",Vijayapura,Sugar & Co-Gen,YES,,1,,1,
"Om Sugars Ltd., Jainapur village, Chikkodi Tq , Belgaum Dist",Belgaum,Sugar & Co-Gen,YES,,1,,1,
" Shri Sai Priya Sugars Ltd.,	 Sy. No. 148, 144-151 of Mygur village & Sy. No. 238, 239 of Hipparagi & Sy. No. 26, 27 of  
Albal village, Jamkhandi taluk, Bagalkot  District",Bagalkot,Sugar & Co-Gen,YES,,1,,1,
"  Belagaum Sugars Pvt Ltd.,	 Sy. No. 60/2, 65/1, 65/6, 69/1, 69/2, 69/3, 69/4, 69/5, 36, Hudali village, Belagaumtaluk and  District.",Belgaum,Sugar & Co-Gen,YES,,1,,1,
Mylar Sugar Limited Birabbi Hoovinahadagali taluk Ballary district,Ballary,Sugar & Co-Gen,YES,,1,,1,
"  Bidar Kissan Shakkar Kharkhana Ltd.,	 		         
 Sy. No. 79, 80/1 to 89/AA, 90/A, 90/AA, 91/A, 91/AA 92/1to 92/6, 93, 94, 96/1 to 96/9, 97/1A,  
 97/1AA & 97/2 Modgal village, Bidar taluk & District	",Bidar,Sugar & Co-Gen,YES,,1,,1,
"Athani Farmers  Sugar Factory Limited,Vishnunagar village, Athani Taluk, Belgaum District Belgaum. ",Belgaum,"Sugar, Co-gen and distillery",YES,Ph is being called,1,,1,
"Bannari Amman Sugars Ltd., Alaganchi Village, Nanjangud Taluk, Mysore District. ",Mysore,"Sugar, Co-gen and distillery",YES,,1,,1,
"Core Green Sugar & Fuels Private Limite, Tumkur Village, Shahapur Taluk, Yadgir District.",Yadgir,"Sugar, Co-gen and distillery",YES,,1,,1,
"Indian Sugar Manufacturing Co. Ltd., A/P Havinal , Indi Taluk, Bijapur District.",Vijayapura,"Sugar, Co-gen and distillery",YES,,1,,1,
"Shree Doodhganga Krishna SSK Distillery Division, Chikkodi Taluk, Belgaum District.",Belgaum,"Sugar, Co-gen and distillery",YES,,1,,1,
"The Mysore Sugar Co., Sugar town, Mandya Dist.",Mandya,"Sugar, Co-gen and distillery",NO,"NPD issued 18.10.16
consent Not isssued as they have Not provided CEMS",0,NPD issued 18.10.16,0,CPCB issued closure direction on 29.03.17
"Shree Renuka Sugars Ltd., Manoli, Soundatti Taluk, Belgaum District",Belgaum,"Sugar, Co-gen and distillery",YES,,1,,1,
"Sri. Chamundeshwari Sugars-Distillery uni, Bhatathi nagar, Maddur Taluk, Mandya District.",Mandya,"Sugar, Co-gen and distillery",YES,,1,,1,
"Sri. Hiranyakeshi SSK Niymait  (Distillery Unit), Sankeshwara – 591 314, Belgaum District.",Belgaum,"Sugar, Co-gen and distillery",YES,SCN issued on 26.04.17,1,,1,"CPCB revoked  directions on 07.02.17
Consent pending"
"Ugar Sugar Works,Ugarkhurd, Belgaum District.",Belgaum,"Sugar, Co-gen and distillery",YES,,1,,1,
"Vishwaraj Sugars Limited (Vishwanath Sugar and Steel Industries Ltd.), Bellada Bagewadi, Hukkeri Taluk, Belgaum District",Belgaum,"Sugar, Co-gen and distillery",YES,,1,,1,"Closure order issued by CPCB revoked on 07.12.17
Consent to be issued"
"Shree Renuka Sugars Ltd,  Sy.No.377, Burlatti village, Athani kukatnur Road, Athani Taluk, Belgaum District.",Belgaum,"Sugar, Co-gen and distillery",YES,,1,,1,Direction issued by CPCB is revoked on 07.09.17
"NSL Sugars (Previously M/s.SCM Sugars), Koppa, Maddur Tq., Mandya Dist",Mandya,"Sugar, Co-gen and distillery",YES,,1,,1,Direction issued by CPCB is revoked on 13.09.17
"Shamanur Sugars, Duggavathi Village, Harapanahalli taluk, Davangere District",Davangere,"Sugar, Co-gen and distillery",YES,,1,,1,CPCB revoked  directions on 20.11.17
"Shree Renuka Sugars Ltd., Afzalpur, Gulbarga",Gulberga,"Sugar, Co-gen and distillery",YES,,1,,1,Closure direction issued by CPCB is revoked on 07.09.17
Sathish Sugars Hunshyal P G village Gokak taluk Belgaum district,Belgaum,Sugar & Co-Gen ,YES,,1,,1,
"Vijayanagar sugars Ltd, Gangapur Siranahalli villages, Mundargi Taluk, Gadag District.",Gadag,"Sugar, Co-gen and distillery",YES,,1,,1,
"Bangalore Leather & Leather Crafts, (Anjana Leather Corporation),  Tannery Road, Bangalore.",Bangalore,Tannery,,Not operating (2),2,,2,Permanently closed
"Elite Leather International (P) Ltd., Kacharakanahalli, Bangalore.",Bangalore,Tannery,,Not operating (2),2,,2,Permanently closed
"A.C.C. Limited - Power Plant, (125 MW) Wadi Plant, P.O. Wadi-585 225 Gulbarga District.",Gulberga,Thermal Power,YES,,1,,1,
"Bellary Thermal Power Station, KPC Ltd. Kudithini village, Bellary Taluk and District. ",Ballary,Thermal Power,YES,,1,,1,
"JSW Energy Limited, (2x300 & 2x130 MW), P.B.No.9, Toranagallu, Sandur Taluk, Bellary District.  ",Ballary,Thermal Power,YES,,1,,1,
"Raichur Thermal Power Co. Ltd., Shaktinagar, Raichur District. ",Raichur,Thermal Power,YES,,1,,0,
"Udupi Power Corporation Ltd. Yellur Village, Nandikuru Post, Udupi District - 574138.",Udupi,Thermal Power,YES,,1,,1,
"Kalaburagi Cement Private Limited  Power lant, Chatrasala Village, Chincholi Taluk, Gulburga District",Gulberga,Thermal Power,YES,,1,,1,
"Tata Power Company Ltd., Plot No.1234 to 1240 & 1263 to 1297, Kanaburgi Indl. Area, Autonagar, Belgaum. ",Belgaum,Thermal Power,,Not operating (2),2,,2,Permanently closed
"Surana Power Limited, Plot No.232,229A & 230, Raichur Groth Centre, KIADB Industrial Area, Raichur",Raichur,Thermal Power,,Not operating (2),2,,2,CPCB issued directions on 26.04.17
"Shantha Steel & Power Limited, Kenchanadoni and Hosahalli villages, Koppal Taluk and District ",Koppal,Thermal Power,,Not operating (2),2,,2,Closed
"Himatsingka Linens, Plot No. 1, SEZ, Kiadb Industrial Area, Hanumanthapura Post, Hassan",Hassan,Thermal Power,YES,,1,,1,
Yermarus Thermal Power Station (RTPS ) Chikasugur Raichur taluk and district,Raichur,Thermal Power,YES,,1,,0,
N T P C Limited Kudigi Super Thermal Power Project Kudigi Basavanabagewadi taluk Vijayapura district,Vijayapura,Thermal Power,YES,,1,,1,
"RL Finechem Private Limited, Plot 27-29, KIADB Industrial Area, Gowribidanur, Chikkaballapura district",Chikkaballapura,Bulk Drug and Pharmaceuticals,YES,,1,,1,
Venkatasai Organics Plot No. 57-58 KIADB Industrial Area Humnabad Bidar ,Bidar,Bulk Drug and Pharmaceuticals,NO,Consent Refused on 18.12.17,0,,0,
"Gland Chemicals Private Limited, Plot No. 42B, KIADB Industrial Area, Malur, Kolar District",Kolar,Bulk Drug and Pharmaceuticals,YES,,0,,1,
"SSR Cement Industries Sy No. 37/1, 37/7 Kataganahalli Koppal taluk and district",Koppal,Cement,YES,,1,,NA,Exempted By CPCB for providing CEMS (less than 200 TPD grinding)
Herms Distilleries Private Limited Sy No 98 Yardvadi Raibhagh taluk Belgavi district,Chikkodi,Distillery,YES,,1,,1,
Yadwad Cements private limited Plot No.183 Yadwad Gokak taluk Belgavi district,Chikkodi,Cement,YES,,1,,NA,Exempted By CPCB for providing CEMS (less than 200 TPD grinding)
Shri Bhimashankar SSK Niyamit Dhulakhed and Maragur Indi taluk Vijayapura district,Vijayapura,Sugar & Co-Gen,YES,,1,,0,
"Unique Laboratories Private Limited, Plot No.49, KIADB Industrial Area, Chikkaballapura",Chikkaballapura,Bulk Drug and Pharmaceuticals,YES,Notice issued on 27.12.18,1,,0,
